{
  "project_id": "P-UK-HyNetCCUSCluster",
  "source": "UK Full Business Case (Five Case Model) - Track-1 CCUS Cluster Sequencing",
  "register_location": {
    "key_risks_section_pages": "20-21"
  },
  "overall_sort_rating": null,
  "risks": [
    {
      "risk_id": "R01",
      "description": "There is a risk that government (HMG) is exposed to increased costs for Track-1 post-Financial Investment Decision (FID), and that cost pressures are unaffordable within delegated budgets. [Strategic Case risk T1SR1, Section 2.5 'Identify high level potential risks', p.20-21; source rating: High/Possible.]",
      "category": "financial",
      "sort_rating": null,
      "likelihood": 3,
      "impact": 4,
      "mitigation": "Contractual mechanisms ensure HMG only takes on specific risks where appropriate, with liability limited and counterparties incentivised to control costs; governance mechanisms monitor costs and provide early warning of overruns; contingent liability exposure is accurately monitored."
    },
    {
      "risk_id": "R02",
      "description": "There is a risk that the programme does not realise its intended benefits for Track-1. [Strategic Case risk T1SR3, Section 2.5, p.20-21; source rating: High/Possible.]",
      "category": "organizational",
      "sort_rating": null,
      "likelihood": 3,
      "impact": 4,
      "mitigation": "Projects undergo detailed technical assurance and financial due diligence; projects must meet Initial Conditions Precedent (ICPs) before contracts take effect and Operational CPs thereafter, with LCCC able to terminate and avoid paying for an underperforming project; contractual mechanisms allocate performance-related risk to the private sector; continued engagement with the global Carbon Management Challenge to expand CCUS use and deliver UK trade benefits."
    },
    {
      "risk_id": "R03",
      "description": "There is a risk that the post-FID operating model across public and private sector parties will not operate successfully. [Strategic Case risk T1SR4, Section 2.5, p.20-21; source rating: Medium/Possible.]",
      "category": "organizational",
      "sort_rating": null,
      "likelihood": 3,
      "impact": 3,
      "mitigation": "Progress of arm's-length bodies' (ALBs') capacity (funding, resource) and capability (knowledge, skills) to operate successfully post-FID is monitored through the Delivery Board; a DESNZ Cluster Sponsor Function will be set up between FID and Commercial Operations Date (COD) to mitigate risks to cluster delivery and system integration; readiness-testing mechanisms are in place ahead of FID; FY24/25 funding for the ALBs to fulfil their roles has been secured."
    },
    {
      "risk_id": "R04",
      "description": "There is a risk of an unclear exit path for HMG from its role in the Track-1 commercial framework. [Strategic Case risk T1SR5, Section 2.5, p.20-21; source rating: High/Possible.]",
      "category": "political_regulatory",
      "sort_rating": null,
      "likelihood": 3,
      "impact": 4,
      "mitigation": "Key planned developments include amendments to the process for granting economic licences, a move toward a competitive allocation process for capture contracts, and evolution of transport & storage business models to reflect an increased private-sector role in managing cross-chain risks; cost-reduction levers (UK ETS pricing, CBAMs) are intended to help cultivate a self-sustaining industry and enable an HMG exit path."
    }
  ],
  "notes": "STATUS: PAGE-VERIFIED 2026-07-19 (VS Code session) against the real downloaded PDF (data/raw/P-UK-HyNetCCUSCluster/hynet-full-business-case.pdf, 45 pages, PyMuPDF direct read) -- supersedes the prior DRAFT built from truncated web_fetch text. RISK CONTENT UNCHANGED (T1SR1/T1SR3/T1SR4/T1SR5 descriptions, ratings, and mitigations all match the draft verbatim), but EVERY recorded page number in the draft was wrong, consistently offset by 2 pages, plus two risk-bearing sections the draft never even reached. Corrected real pages: Sec 1.1-1.7 front matter runs longer than assumed, so (1) Executive Summary Sec 1.6 'Deliverability and risks' is real pp.13-14 (draft said 11-12); (2) Strategic Case Sec 2.5 'Identify high level potential risks' -- THE SCORED REGISTER (T1SR1, T1SR3, T1SR4, T1SR5; T1SR2 genuinely absent from the source) -- is real pp.20-21 (draft said 18-19); (3) Economic Case Sec 3.7 'Risk Appraisal' (Table 8 cross-chain: T&S Construction Delay, User Construction Delay, User Underperformance, T&S Availability; Table 9 cross-cutting: Inflation, Commodity Price, Traded Carbon Price, T&S CapEx Overrun, T&S OpEx Overrun) is real p.27, a single page, not 25-26; (4) Commercial Case Sec 4.2.4 'Cluster-level commercial risk assessment' (narrative synthesis explicitly cross-referencing T1SR1/T1SR3) is real p.32, not 30-31. NEWLY RETRIEVED (never reached by the truncated web_fetch): (5) Financial Case Sec 5.7 'Financial risks', real pp.36-38 -- 11 named sub-items (5.7.1 Revenue Support Agreement, 5.7.2 Supplementary Compensation Agreement, 5.7.3 Discontinuation Agreement, 5.7.4 Discontinuation risk for EETH/Protos, 5.7.5 Decommissioning fund shortfall, 5.7.6 Secretary of State direct agreements, 5.7.7 NSTA/Opred financial security, 5.7.8 Fraud, 5.7.9 Financial sensitivities, 5.7.10 Cross-chain and cross-cutting risks [explicitly restates Table 8/9's named risk items], 5.7.11 Eni T&S network construction overruns) -- substantively overlaps the scored Sec 2.5/3.7 risk categories (Discontinuation, cross-chain/cross-cutting risks) and must be excised for leakage safety even though not itself scored; (6) Management Case Sec 6.7 'Risk management' (real p.44-45) is pure process/governance description (RAID cycle, GMPP/ORB/Track-1 Dashboard reporting) with no named or rated risk items -- confirmed safe to leave as planning text, same precedent as WB PADs' M&E/grievance-process sections.\n\nSTRUCTURE (unchanged from prior note): UK Five Case Model business cases scatter risk content across multiple sections rather than one consolidated section like WB's SORT table + Key Risks, in incompatible framings (narrative, rated table, quantitative NPV sensitivity).\n\nMETHODOLOGY (2026-07-19 decision, unchanged): ground truth = ONLY the single closest structural analog to a WB SORT-table register, which for this document is Sec 2.5 (now pp.20-21). All other risk-bearing sections listed above are excised from model-facing planning text for leakage safety but are not scored against.\n\nRATING CONVENTION (unchanged): the source gives each Sec 2.5 risk a combined qualitative rating (e.g. 'High/Possible') rather than WB's single SORT ordinal. Read as Impact/Likelihood per the standard UK government 5x5 risk-matrix convention (Likelihood: Rare=1, Unlikely=2, Possible=3, Likely=4, Almost Certain=5; Impact: Negligible=1, Low=2, Medium=3, High=4, Very High=5). The qualitative terms are verbatim from the source; the specific 1-5 integers are this project's interpretive mapping, not numbers stated by the source, and should be checked by a second rater before use.\n\nSOURCE: https://assets.publishing.service.gov.uk/media/685bbbb5c07c71e5a8709799/hynet-full-business-case.pdf (downloaded directly, 2026-07-19)."
}
